{
	"$schema": "http://json-schema.org/draft-07/schema#",
	"type": "object",
	"required": ["name", "version", "dependencies"],
	"definitions": {
		"dependencyObject": {
			"type": "object",
			"additionalProperties": {
				"type": "object",
				"oneOf": [
					{
						"required": ["path"],
						"properties": {
							"path": {
								"type": "string",
								"description": "Local filesystem path to dependency"
							},
							"package": {
								"type": "string",
								"description": "Actual package name at the path, when aliasing (key is the require name)"
							}
						},
						"additionalProperties": false
					},
					{
						"required": ["git"],
						"properties": {
							"git": {
								"type": "string",
								"description": "Git repository URL"
							},
							"branch": {
								"type": "string",
								"description": "Git branch to use"
							},
							"commit": {
								"type": "string",
								"description": "Git commit hash to pin"
							},
							"package": {
								"type": "string",
								"description": "Actual package name in the repository, when aliasing (key is the require name)"
							}
						},
						"additionalProperties": false
					},
					{
						"required": ["version"],
						"properties": {
							"version": {
								"type": "string",
								"description": "Registry package version to install"
							},
							"package": {
								"type": "string",
								"description": "Actual package name in the registry, when aliasing (key is the require name)"
							}
						},
						"additionalProperties": false
					}
				]
			}
		}
	},
	"properties": {
		"name": {
			"type": "string",
			"description": "Package name"
		},
		"version": {
			"type": "string",
			"pattern": "^\\d+\\.\\d+\\.\\d+$",
			"description": "Semantic version number"
		},
		"dependencies": {
			"allOf": [
				{
					"$ref": "#/definitions/dependencyObject"
				},
				{
					"description": "Package dependencies with source locations"
				}
			]
		},
		"bin": {
			"type": "string",
			"description": "Entry point script to run when using lpm run without a file argument"
		},
		"scripts": {
			"type": "object",
			"description": "Named scripts that can be run with lpm run <name> or lpm <name>",
			"additionalProperties": {
				"type": "string",
				"description": "Shell command to execute"
			}
		},
		"engine": {
			"type": "string",
			"enum": ["lua", "luajit", "lpm"],
			"description": "The Lua engine to use"
		},
		"devDependencies": {
			"allOf": [
				{
					"$ref": "#/definitions/dependencyObject"
				},
				{
					"description": "Development dependencies with source locations"
				}
			]
		}
	},
	"additionalProperties": false
}
