{
	"name": "rocked",
	"version": "0.1.0",
	"dependencies": {
		"fs": { "version": "^0.2.0" },
		"path": { "version": "^0.1.0" },
		"process": { "version": "^0.1.1" },
		"env": { "version": "^0.1.0" },
		"lua-sys": { "version": "^0.1.2" }
	},
	"devDependencies": {
		"curl-sys": { "version": "0.1" }
	}
}
